{
  "schemaVersion": 1,
  "package": "com.solotopia.nova.framework",
  "capabilityGroups": {
    "assessment": [
      "nova-project-router",
      "nova-project-check-readiness",
      "nova-project-diagnose-startup",
      "nova-project-preflight-build",
      "nova-project-diagnose-build",
      "nova-project-diagnose-device-runtime"
    ],
    "onboarding": [
      "nova-project-router",
      "nova-project-check-readiness",
      "nova-project-manage-upm-package",
      "nova-project-upgrade-framework",
      "nova-project-setup-entry-scene",
      "nova-project-configure-runtime",
      "nova-project-onboard-sdk-kit"
    ],
    "data": [
      "nova-project-router",
      "nova-project-export-tables",
      "nova-project-integrate-table",
      "nova-project-configure-runtime",
      "nova-project-update-localization",
      "nova-project-data-driven-ui"
    ],
    "ui": [
      "nova-project-router",
      "nova-project-ui-create-view",
      "nova-project-update-ui-view",
      "nova-project-data-driven-ui"
    ],
    "resource": [
      "nova-project-router",
      "nova-project-integrate-resource",
      "nova-project-integrate-content-scene",
      "nova-project-build-bundles"
    ],
    "hotfix": [
      "nova-project-router",
      "nova-project-refresh-hotfix-dlls",
      "nova-project-generate-hybridclr-artifacts",
      "nova-project-build-bundles",
      "nova-project-diagnose-startup"
    ],
    "network": [
      "nova-project-router",
      "nova-project-integrate-network-api"
    ],
    "sound": [
      "nova-project-router",
      "nova-project-integrate-sound"
    ],
    "vibration": [
      "nova-project-router",
      "nova-project-integrate-vibration"
    ],
    "procedure": [
      "nova-project-router",
      "nova-project-integrate-procedure"
    ],
    "package": [
      "nova-project-router",
      "nova-project-manage-upm-package",
      "nova-project-upgrade-framework",
      "nova-project-onboard-sdk-kit"
    ],
    "delivery": [
      "nova-project-router",
      "nova-project-preflight-build",
      "nova-project-build-bundles",
      "nova-project-build-player",
      "nova-project-upload-google-play",
      "nova-project-diagnose-build",
      "nova-project-diagnose-device-runtime"
    ],
    "event": [
      "nova-project-router",
      "nova-project-integrate-event"
    ],
    "persistence": [
      "nova-project-router",
      "nova-project-integrate-persistence"
    ],
    "scene": [
      "nova-project-router",
      "nova-project-setup-entry-scene",
      "nova-project-integrate-content-scene"
    ],
    "sdk-kit": [
      "nova-project-router",
      "nova-project-manage-upm-package",
      "nova-project-configure-runtime",
      "nova-project-onboard-sdk-kit",
      "nova-project-resolve-android-dependencies",
      "nova-project-diagnose-device-runtime"
    ],
    "build": [
      "nova-project-router",
      "nova-project-preflight-build",
      "nova-project-resolve-android-dependencies",
      "nova-project-build-bundles",
      "nova-project-build-player",
      "nova-project-diagnose-build"
    ],
    "device": [
      "nova-project-router",
      "nova-project-diagnose-device-runtime"
    ]
  },
  "skills": [
    {
      "id": "nova-project-router",
      "path": "Skills/nova-project-router",
      "kind": "router",
      "status": "experimental",
      "journeys": [
        "assessment",
        "onboarding",
        "feature",
        "configuration",
        "resource",
        "build",
        "diagnosis"
      ],
      "effects": [
        "read"
      ],
      "minimumEvidence": "static"
    },
    {
      "id": "nova-project-check-readiness",
      "path": "Skills/nova-project-check-readiness",
      "kind": "operation",
      "status": "experimental",
      "journeys": [
        "assessment",
        "onboarding",
        "diagnosis"
      ],
      "effects": [
        "read"
      ],
      "minimumEvidence": "static"
    },
    {
      "id": "nova-project-diagnose-startup",
      "path": "Skills/nova-project-diagnose-startup",
      "kind": "operation",
      "status": "experimental",
      "journeys": [
        "diagnosis"
      ],
      "effects": [
        "read"
      ],
      "minimumEvidence": "static"
    },
    {
      "id": "nova-project-setup-entry-scene",
      "path": "Skills/nova-project-setup-entry-scene",
      "kind": "operation",
      "status": "experimental",
      "journeys": [
        "onboarding",
        "configuration"
      ],
      "effects": [
        "workspace-write",
        "unity-write"
      ],
      "minimumEvidence": "play"
    },
    {
      "id": "nova-project-configure-runtime",
      "path": "Skills/nova-project-configure-runtime",
      "kind": "operation",
      "status": "experimental",
      "journeys": [
        "onboarding",
        "configuration"
      ],
      "effects": [
        "unity-write",
        "generated-output"
      ],
      "minimumEvidence": "compile"
    },
    {
      "id": "nova-project-manage-upm-package",
      "path": "Skills/nova-project-manage-upm-package",
      "kind": "operation",
      "status": "experimental",
      "journeys": [
        "onboarding",
        "package",
        "configuration"
      ],
      "effects": [
        "workspace-write",
        "unity-write"
      ],
      "minimumEvidence": "compile"
    },
    {
      "id": "nova-project-upgrade-framework",
      "path": "Skills/nova-project-upgrade-framework",
      "kind": "operation",
      "status": "experimental",
      "journeys": [
        "onboarding",
        "package"
      ],
      "effects": [
        "workspace-write",
        "unity-write"
      ],
      "minimumEvidence": "compile"
    },
    {
      "id": "nova-project-export-tables",
      "path": "Skills/nova-project-export-tables",
      "kind": "operation",
      "status": "experimental",
      "journeys": [
        "data"
      ],
      "effects": [
        "workspace-write",
        "unity-write",
        "generated-output"
      ],
      "minimumEvidence": "compile"
    },
    {
      "id": "nova-project-integrate-table",
      "path": "Skills/nova-project-integrate-table",
      "kind": "operation",
      "status": "experimental",
      "journeys": [
        "feature",
        "data"
      ],
      "effects": [
        "workspace-write",
        "unity-write",
        "generated-output"
      ],
      "minimumEvidence": "play"
    },
    {
      "id": "nova-project-update-localization",
      "path": "Skills/nova-project-update-localization",
      "kind": "operation",
      "status": "experimental",
      "journeys": [
        "feature",
        "localization"
      ],
      "effects": [
        "workspace-write",
        "unity-write",
        "generated-output"
      ],
      "minimumEvidence": "play"
    },
    {
      "id": "nova-project-ui-create-view",
      "path": "Skills/nova-project-ui-create-view",
      "kind": "operation",
      "status": "experimental",
      "journeys": [
        "feature",
        "ui"
      ],
      "effects": [
        "workspace-write",
        "unity-write",
        "generated-output"
      ],
      "minimumEvidence": "compile"
    },
    {
      "id": "nova-project-update-ui-view",
      "path": "Skills/nova-project-update-ui-view",
      "kind": "operation",
      "status": "experimental",
      "journeys": [
        "feature",
        "ui"
      ],
      "effects": [
        "workspace-write",
        "unity-write",
        "generated-output"
      ],
      "minimumEvidence": "compile"
    },
    {
      "id": "nova-project-data-driven-ui",
      "path": "Skills/nova-project-data-driven-ui",
      "kind": "workflow",
      "status": "experimental",
      "journeys": [
        "feature",
        "ui",
        "data"
      ],
      "effects": [
        "workspace-write",
        "unity-write",
        "generated-output"
      ],
      "minimumEvidence": "play"
    },
    {
      "id": "nova-project-integrate-resource",
      "path": "Skills/nova-project-integrate-resource",
      "kind": "operation",
      "status": "experimental",
      "journeys": [
        "feature",
        "resource"
      ],
      "effects": [
        "workspace-write",
        "unity-write",
        "generated-output"
      ],
      "minimumEvidence": "play"
    },
    {
      "id": "nova-project-integrate-network-api",
      "path": "Skills/nova-project-integrate-network-api",
      "kind": "operation",
      "status": "experimental",
      "journeys": [
        "feature",
        "network"
      ],
      "effects": [
        "workspace-write",
        "unity-write",
        "generated-output"
      ],
      "minimumEvidence": "play"
    },
    {
      "id": "nova-project-integrate-sound",
      "path": "Skills/nova-project-integrate-sound",
      "kind": "operation",
      "status": "experimental",
      "journeys": [
        "feature",
        "sound"
      ],
      "effects": [
        "workspace-write",
        "unity-write",
        "generated-output"
      ],
      "minimumEvidence": "play"
    },
    {
      "id": "nova-project-integrate-vibration",
      "path": "Skills/nova-project-integrate-vibration",
      "kind": "operation",
      "status": "experimental",
      "journeys": [
        "feature",
        "vibration"
      ],
      "effects": [
        "workspace-write",
        "unity-write",
        "generated-output"
      ],
      "minimumEvidence": "play"
    },
    {
      "id": "nova-project-integrate-procedure",
      "path": "Skills/nova-project-integrate-procedure",
      "kind": "operation",
      "status": "experimental",
      "journeys": [
        "feature",
        "procedure"
      ],
      "effects": [
        "workspace-write"
      ],
      "minimumEvidence": "play"
    },
    {
      "id": "nova-project-refresh-hotfix-dlls",
      "path": "Skills/nova-project-refresh-hotfix-dlls",
      "kind": "operation",
      "status": "experimental",
      "journeys": [
        "build",
        "hotfix"